{"$schema": "../schemas/approval.schema.json", "approval_id": "appr-20260901-2f50af", "action": "campaign_publication", "object_id": "cand-cj-sku-magnetic-cord-6p", "requested_by": "trader_bot", "approved_by": "Ahmad", "approved_at": "2026-09-01T03:07:09.277706+00:00", "status": "APPROVED", "scope": {"market_config_id": "us-pilot", "candidate_id": "cand-cj-sku-magnetic-cord-6p", "max_budget": 0.0, "currency": "USD"}, "constraints": ["Ad spend capped at $0.00 total across 7 days", "Daily spend limit: $0.00/day", "Target CPA: $9.27", "Stop campaign immediately if CPA exceeds 1.5x predicted target", "Fulfillment must originate from verified domestic warehouse"], "idempotency_key": "appr:us-pilot:cand-cj-sku-magnetic-cord-6p:b70f", "expires_at": "2026-09-15T03:07:09.277715+00:00", "verification_hash": "025491c895b34059bc920ff62e60192013858229f58667ec5e6e84ea5c2fcfa6"}