{"$schema": "../schemas/approval.schema.json", "approval_id": "appr-20260901-0e7073", "action": "campaign_publication", "object_id": "candidate-us-2026-09-01-magnetic-wristband", "requested_by": "trader_bot", "approved_by": "Ahmad", "approved_at": "2026-09-01T03:22:00.861807+00:00", "status": "APPROVED", "scope": {"market_config_id": "us-pilot", "candidate_id": "candidate-us-2026-09-01-magnetic-wristband", "max_budget": 0.0, "currency": "USD"}, "constraints": ["Ad spend capped at $0.00 total across 7 days", "Daily spend limit: $0.00/day", "Target CPA: $14.00", "Stop campaign immediately if CPA exceeds 1.5x predicted target", "Fulfillment must originate from verified domestic warehouse"], "idempotency_key": "appr:us-pilot:candidate-us-2026-09-01-magnetic-wristband:3d89", "expires_at": "2026-09-15T03:22:00.861815+00:00", "verification_hash": "ec07aca2327032f8e2f12d8e7a102ca77db1937c893168072d2a7ab99bf78f7b"}