{
  "$schema": "../schemas/approval.schema.json",
  "approval_id": "appr-20260901-5bf91d",
  "action": "test_campaign_launch",
  "object_id": "candidate-us-2026-09-01-foldable-silicone-bowl",
  "requested_by": "trader_bot",
  "approved_by": "Ahmad",
  "approved_at": "2026-09-01T02:43:51.054051+00:00",
  "status": "CONSUMED",
  "scope": {
    "market_config_id": "us-pilot",
    "candidate_id": "candidate-us-2026-09-01-foldable-silicone-bowl",
    "max_budget": 300.0,
    "currency": "USD"
  },
  "constraints": [
    "Ad spend capped at $300.00 total across 7 days",
    "Daily spend limit: $50.00/day",
    "Target CPA: $10.50",
    "Stop campaign immediately if CPA exceeds 1.5x predicted target",
    "Fulfillment must originate from verified domestic warehouse"
  ],
  "idempotency_key": "appr:us-pilot:candidate-us-2026-09-01-foldable-silicone-bowl:6515",
  "expires_at": "2026-09-15T02:43:51.054059+00:00",
  "verification_hash": "bf0fc89c25bc6aeb3002cbc8eb6e7aa71fa89b1acf5eb10ff7e4f241b586b39d"
}